{
  "actions": [
    {
      "can_enable_after_explicit_action_approval": false,
      "classification": "UNKNOWN_WRITE",
      "default_enabled": false,
      "direct_endpoint_call_allowed": false,
      "locator": {
        "coordinate_fallback_allowed": false,
        "evidence_status": "UNVERIFIED_REQUIRES_CURRENT_PROBE",
        "expected_count": 1,
        "must_be_visible": true,
        "runtime_resolution_required": true,
        "strategy": "ROLE_AND_EXACT_TEXT",
        "text": "预览",
        "usable_without_current_probe": false
      },
      "logical_name": "remote_preview",
      "network_signature_status": "UNVERIFIED_QUARANTINED",
      "risk": "CRITICAL",
      "visible_ui_required": true
    },
    {
      "can_enable_after_explicit_action_approval": false,
      "classification": "UNKNOWN_WRITE",
      "default_enabled": false,
      "direct_endpoint_call_allowed": false,
      "locator": {
        "coordinate_fallback_allowed": false,
        "evidence_status": "UNVERIFIED_REQUIRES_CURRENT_PROBE",
        "expected_count": 1,
        "must_be_visible": true,
        "runtime_resolution_required": true,
        "strategy": "ROLE_AND_EXACT_TEXT",
        "text": "下一步",
        "usable_without_current_probe": false
      },
      "logical_name": "step_validation",
      "network_signature_status": "UNVERIFIED_QUARANTINED",
      "risk": "CRITICAL",
      "visible_ui_required": true
    },
    {
      "can_enable_after_explicit_action_approval": true,
      "classification": "REVERSIBLE_DRAFT_WRITE",
      "default_enabled": false,
      "direct_endpoint_call_allowed": false,
      "locator": {
        "coordinate_fallback_allowed": false,
        "evidence_status": "STALE_DIAGNOSTIC_ONLY",
        "expected_count": 1,
        "must_be_visible": true,
        "runtime_resolution_required": true,
        "strategy": "ROLE_AND_EXACT_TEXT",
        "text": "保存",
        "usable_without_current_probe": false
      },
      "logical_name": "save_draft",
      "network_signature_status": "UNVERIFIED_QUARANTINED",
      "risk": "CRITICAL",
      "visible_ui_required": true
    },
    {
      "can_enable_after_explicit_action_approval": false,
      "classification": "FINAL_WRITE",
      "default_enabled": false,
      "direct_endpoint_call_allowed": false,
      "locator": {
        "coordinate_fallback_allowed": false,
        "evidence_status": "STALE_DIAGNOSTIC_ONLY",
        "expected_count": 1,
        "must_be_visible": true,
        "runtime_resolution_required": true,
        "strategy": "ROLE_AND_EXACT_TEXT",
        "text": "提交",
        "usable_without_current_probe": false
      },
      "logical_name": "submit_product",
      "network_signature_status": "UNVERIFIED_QUARANTINED",
      "risk": "CRITICAL",
      "visible_ui_required": true
    }
  ],
  "dynamic_namespaces": [
    {
      "collision_is_blocking": true,
      "diagnostic_ids_usable_for_write": false,
      "live_row_locator": {
        "container_selector": ".sell-catProp-list",
        "coordinate_fallback_allowed": false,
        "evidence_status": "STALE_DIAGNOSTIC_ONLY",
        "expected_count": 1,
        "must_be_visible": true,
        "runtime_resolution_required": true,
        "slot_selector": ".sell-catProp-item",
        "strategy": "LIVE_CATEGORY_ROWS",
        "usable_without_current_probe": false
      },
      "name_pattern": "^p-[0-9]+$",
      "namespace": "category_properties",
      "persist_for_current_run_only": true,
      "resolution_strategy": "CURRENT_VISIBLE_LABEL_AND_SCHEMA_KEY",
      "section": "CATEGORY_PROPERTIES",
      "stale_ids_rejected": true,
      "write_binding_requires_probe_receipt": true
    }
  ],
  "evidence": {
    "actions_inventory_sha256": "0000000000000000000000000000000000000000000000000000000000000000",
    "controls_inventory_sha256": "0000000000000000000000000000000000000000000000000000000000000000",
    "current_probe_required": true,
    "observed_at": "2000-01-01T00:00:00Z",
    "page_function_study_sha256": "0000000000000000000000000000000000000000000000000000000000000000",
    "probe_sha256": "0000000000000000000000000000000000000000000000000000000000000000",
    "status": "STALE_DIAGNOSTIC_ONLY",
    "unverified_candidates_may_be_allowlisted": false,
    "write_endpoint_evidence": "NONE_VERIFIED"
  },
  "fields": [
    {
      "allowed_source_dispositions": [
        "APPROVED_INTERNAL_SOURCE"
      ],
      "clear_before_fill": true,
      "dynamic_namespace": null,
      "field_class": "DATA",
      "inheritance_policy": "CLEAR_AND_REPLACE",
      "locator": {
        "coordinate_fallback_allowed": false,
        "evidence_status": "STALE_DIAGNOSTIC_ONLY",
        "expected_count": 1,
        "fallback_role": "textbox",
        "label_contains_any": [
          "产品标题",
          "Product Title"
        ],
        "must_be_visible": true,
        "runtime_resolution_required": true,
        "selector": "input#productTitle",
        "strategy": "CSS_PRIMARY_THEN_SEMANTIC_FALLBACK",
        "usable_without_current_probe": false
      },
      "logical_name": "product_title",
      "readback": {
        "hash_compare_required": true,
        "normalization": "TRIM_AND_NORMALIZE_NEWLINES",
        "strategy": "CONTROL_VALUE"
      },
      "rejected_source_dispositions": [
        "UNUSABLE_WASTE_RECORD",
        "BLOCKED_UNCLASSIFIED",
        "HISTORICAL_REFERENCE_ONLY"
      ],
      "required_policy": "REQUIRED",
      "risk": "HIGH",
      "runtime_binding_required": true,
      "section": "BASIC_INFO",
      "source_policy": "VERIFIED_PRODUCT_FACT",
      "template_value_allowed": false,
      "value_type": "STRING"
    },
    {
      "allowed_source_dispositions": [
        "APPROVED_INTERNAL_SOURCE"
      ],
      "clear_before_fill": true,
      "dynamic_namespace": null,
      "field_class": "DATA",
      "inheritance_policy": "CLEAR_AND_REPLACE",
      "locator": {
        "coordinate_fallback_allowed": false,
        "evidence_status": "UNVERIFIED_REQUIRES_CURRENT_PROBE",
        "expected_count": 1,
        "label_contains_any": [
          "副标题",
          "Subtitle"
        ],
        "must_be_visible": true,
        "runtime_resolution_required": true,
        "strategy": "VISIBLE_LABEL_THEN_DESCENDANT_CONTROL",
        "usable_without_current_probe": false
      },
      "logical_name": "product_subtitle",
      "readback": {
        "hash_compare_required": true,
        "normalization": "TRIM_AND_NORMALIZE_NEWLINES",
        "strategy": "CONTROL_VALUE"
      },
      "rejected_source_dispositions": [
        "UNUSABLE_WASTE_RECORD",
        "BLOCKED_UNCLASSIFIED",
        "HISTORICAL_REFERENCE_ONLY"
      ],
      "required_policy": "OPTIONAL_IF_APPROVED",
      "risk": "MEDIUM",
      "runtime_binding_required": true,
      "section": "BASIC_INFO",
      "source_policy": "VERIFIED_PRODUCT_FACT",
      "template_value_allowed": false,
      "value_type": "STRING"
    },
    {
      "allowed_source_dispositions": [
        "APPROVED_INTERNAL_SOURCE"
      ],
      "clear_before_fill": true,
      "dynamic_namespace": null,
      "field_class": "DATA",
      "inheritance_policy": "CLEAR_AND_REPLACE",
      "locator": {
        "coordinate_fallback_allowed": false,
        "evidence_status": "UNVERIFIED_REQUIRES_CURRENT_PROBE",
        "expected_count": 1,
        "label_contains_any": [
          "关键词",
          "Keywords"
        ],
        "must_be_visible": true,
        "runtime_resolution_required": true,
        "strategy": "VISIBLE_LABEL_THEN_DESCENDANT_CONTROL",
        "usable_without_current_probe": false
      },
      "logical_name": "keywords",
      "readback": {
        "hash_compare_required": true,
        "normalization": "VISIBLE_TEXT_CANONICAL",
        "strategy": "VISIBLE_TEXT"
      },
      "rejected_source_dispositions": [
        "UNUSABLE_WASTE_RECORD",
        "BLOCKED_UNCLASSIFIED",
        "HISTORICAL_REFERENCE_ONLY"
      ],
      "required_policy": "OPTIONAL_IF_APPROVED",
      "risk": "MEDIUM",
      "runtime_binding_required": true,
      "section": "BASIC_INFO",
      "source_policy": "VERIFIED_PRODUCT_FACT",
      "template_value_allowed": false,
      "value_type": "STRING_LIST"
    },
    {
      "allowed_source_dispositions": [
        "APPROVED_INTERNAL_SOURCE"
      ],
      "clear_before_fill": true,
      "dynamic_namespace": null,
      "field_class": "ACCOUNT_SETTING",
      "inheritance_policy": "CLEAR_AND_REPLACE",
      "locator": {
        "coordinate_fallback_allowed": false,
        "evidence_status": "STALE_DIAGNOSTIC_ONLY",
        "expected_count": 1,
        "label_contains_any": [
          "产品分组",
          "Product Group"
        ],
        "must_be_visible": true,
        "runtime_resolution_required": true,
        "strategy": "VISIBLE_LABEL_THEN_DESCENDANT_CONTROL",
        "usable_without_current_probe": false
      },
      "logical_name": "product_group",
      "readback": {
        "hash_compare_required": true,
        "normalization": "VISIBLE_TEXT_CANONICAL",
        "strategy": "VISIBLE_TEXT"
      },
      "rejected_source_dispositions": [
        "UNUSABLE_WASTE_RECORD",
        "BLOCKED_UNCLASSIFIED",
        "HISTORICAL_REFERENCE_ONLY"
      ],
      "required_policy": "REVIEW_REQUIRED",
      "risk": "HIGH",
      "runtime_binding_required": true,
      "section": "BASIC_INFO",
      "source_policy": "APPROVED_ACCOUNT_SETTING",
      "template_value_allowed": false,
      "value_type": "STRING"
    },
    {
      "allowed_source_dispositions": [
        "APPROVED_INTERNAL_SOURCE"
      ],
      "clear_before_fill": false,
      "dynamic_namespace": null,
      "field_class": "REVIEW_ONLY",
      "inheritance_policy": "VERIFY_FIXED_CONTEXT",
      "locator": {
        "coordinate_fallback_allowed": false,
        "evidence_status": "UNVERIFIED_REQUIRES_CURRENT_PROBE",
        "expected_count": 1,
        "label_contains_any": [
          "产品类目",
          "Category"
        ],